Keyword Text,Competition,Competition Index,Search Volume,Low Top Page Bid,High Top Page Bid
spell spelling bee,LOW,0,1500000,0.40,3.84
spell the bee,LOW,0,1500000,0.40,3.84
spelling bee nyt,LOW,0,550000,0.07,0.26
nyt spelling bee,LOW,0,550000,0.07,0.32
spell bee games,LOW,0,201000,0.99,2.00
spelling competition games,LOW,0,201000,0.99,2.00
spelling bee free,LOW,0,74000,0.10,0.10
free spell bee,LOW,0,74000,0.10,0.10
free spellingbee,LOW,0,74000,0.10,0.10
spelling bee words,LOW,7,49500,0.01,0.04
spelling bee word list,LOW,7,49500,0.01,0.04
spelling bee list,LOW,7,49500,0.01,0.04
spelling contest words,LOW,7,49500,0.01,0.04
spell b words,LOW,7,49500,0.01,0.04
spell bee contest words,LOW,7,49500,0.01,0.04
spelling bee spelling words,LOW,7,49500,0.01,0.04
spelling bee unlimited,LOW,0,40500,0.10,0.22
spell bee unlimited,LOW,0,40500,0.10,0.22
spellingbee unlimited,LOW,0,40500,0.10,0.22
spelling bee today,LOW,0,22200,,
spelling bee games free,LOW,0,18100,0.10,1.66
the new york times spelling bee,LOW,1,14800,0.07,0.82
spelling bee the new york times,LOW,1,14800,0.07,0.29
online spelling bee games,LOW,1,12100,0.10,2.00
nyt spelling,LOW,0,9900,,
free online spelling bee,LOW,0,9900,0.10,2.00
free online spelling bee games,LOW,1,9900,0.10,1.32
free spelling bee games online,LOW,1,9900,0.10,1.32
hard spelling bee words,LOW,4,6600,0.01,0.03
challenging spelling bee words,LOW,4,6600,0.01,0.03
complicated spelling bee words,LOW,4,6600,0.01,0.03
difficult spell bee words,LOW,4,6600,0.01,0.03
difficult words for spelling contest,LOW,4,6600,0.01,0.03
difficult words to spell for spelling bee,LOW,4,6600,0.01,0.03
difficult words to spell in spelling bee,LOW,4,6600,0.01,0.03
hardest spell bee words,LOW,4,6600,0.01,0.03
hardest word spelling bee,LOW,4,6600,0.01,0.03
hardest words for a spelling bee,LOW,4,6600,0.01,0.03
spelling words for seventh graders,MEDIUM,38,6600,0.02,1.39
spelling bee nyt free,LOW,0,5400,0.12,2.00
spelling bee words for adults,LOW,6,5400,0.01,0.04
ei words,LOW,0,5400,,
spelling b words for adults,LOW,6,5400,0.01,0.04
spelling bee for adults words,LOW,6,5400,0.01,0.04
spelling bee words nyt,LOW,0,4400,,
spelling bee 100 free,LOW,0,4400,,
spelling bee word today,LOW,0,4400,,
spelling words for eighth graders,LOW,21,4400,0.41,2.10
free spelling bee for adults,LOW,2,3600,0.10,0.10
nyt wordle spelling bee,LOW,3,3600,0.05,0.17
nytimes wordle spelling bee,LOW,3,3600,0.05,0.17
spelling for 11,LOW,0,3600,,
words to spell for 4th graders,HIGH,94,3600,0.08,2.16
spelling bee ny times,LOW,1,2900,0.09,0.23
unlimited spelling bee,LOW,0,2900,,
scripps spelling bee study list,LOW,0,2900,,
spelling bee practice,LOW,4,2400,0.57,2.78
spelling challenge,LOW,1,2400,0.59,2.00
mis spelt,LOW,0,2400,,
national scripps spelling bee word list,LOW,0,2400,,
scripps spelling bee word list,LOW,0,2400,,
scripps spelling word list,LOW,0,2400,,
spelling bee online and free,LOW,0,2400,,
the spelling bee,LOW,1,1900,0.52,2.56
nyt spelling bee free,LOW,0,1900,,
nyt com spelling bee,LOW,3,1900,0.06,0.26
free bee games,LOW,0,1900,,
ny spelling bee free,LOW,0,1900,,
scripp spelling bee words,LOW,0,1900,,
scripps national spelling bee words,LOW,0,1900,,
scripps spelling bee list,LOW,0,1900,,
scripps spelling words,LOW,0,1900,,
spelling for 12,LOW,0,1900,,
spelling for 14,LOW,0,1900,,
the spelling b,LOW,1,1900,0.52,2.56
spelling bee for adults,LOW,4,1600,0.02,0.18
hard spelling b words,LOW,2,1600,0.01,0.03
hard words in spelling bee,LOW,2,1600,0.01,0.03
hard words to spell spelling bee,LOW,2,1600,0.01,0.03
hardest word in spelling bee,LOW,2,1600,0.01,0.03
most difficult spelling bee words,LOW,2,1600,0.01,0.03
spelling bee words for high schoolers,LOW,6,1600,0.01,0.02
spelling bee words hardest,LOW,2,1600,0.01,0.03
spelling competition for adults,LOW,4,1600,0.02,0.18
today's spelling bee words,LOW,0,1600,,
bee word games,LOW,0,1300,0.96,7.32
spelling bee free unlimited,LOW,0,1300,,
spelling bee word games,LOW,1,1300,0.87,2.20
spelling fourth,LOW,1,1300,,
word games spelling bee,LOW,1,1300,0.87,2.20
wordle nyt spelling bee,LOW,1,1300,0.06,0.21
adult spelling list,LOW,21,1000,0.01,0.07
adult spelling words,LOW,21,1000,0.01,0.07
nyt spelling bee unlimited,LOW,0,1000,,
nytimes spelling bee unlimited,LOW,0,1000,,
spelling bee unlimited nyt,LOW,0,1000,,
wordle spelling bee today,LOW,1,1000,0.04,0.14
good spelling bee words,LOW,6,880,0.01,0.04
best spelling bee words,LOW,6,880,0.01,0.04
great spelling bee words,LOW,6,880,0.01,0.04
junior high spelling bee words,LOW,3,880,0.10,2.15
spelling bee today nytimes,LOW,1,880,0.03,0.11
spelling bee unlimited free,LOW,0,880,,
spelling bee words for middle schoolers,LOW,3,880,0.10,2.15
spelling for fourth graders,HIGH,92,880,0.46,2.91
words for today's spelling bee,LOW,0,880,,
new york times spelling bee free,LOW,1,720,0.08,0.19
spelling for adults,LOW,10,720,0.34,2.58
spelling bee quiz,LOW,2,720,1.30,7.26
word bee,LOW,3,720,2.38,23.88
spelling bee questions,LOW,0,720,0.48,2.32
spelling bee for 1st graders,HIGH,79,720,0.31,1.63
easy spelling bee words,LOW,17,720,0.01,0.31
hard words to spell for 5th graders,MEDIUM,40,720,0.01,0.57
new york times spelling bee puzzles,LOW,0,720,,
spell b test,LOW,2,720,1.25,3.26
spelling contest questions,LOW,0,720,0.48,2.32
spelling for elementary,LOW,3,720,1.01,4.54
spelling second,LOW,0,720,,
spelling wordle,LOW,0,720,,
spellingbee free,LOW,0,720,,
wordle spelling,LOW,0,720,,
games like spelling bee,LOW,25,590,0.10,1.83
free spelling bee nyt,LOW,0,590,,
spelling bee for 2nd graders,HIGH,82,590,0.02,1.63
free bee spelling,LOW,0,590,,
intermediate spelling,LOW,0,590,,
national spelling bee words,LOW,0,590,,
nyt spelling bee words,LOW,0,590,,
spelling bee for high schoolers,LOW,2,590,0.01,0.10
word club spelling bee,LOW,3,480,,
hard spelling bee words for adults,LOW,3,480,0.01,0.05
bee word,LOW,2,480,0.01,0.04
hard spelling bee,LOW,1,480,0.01,0.04
hardest spelling bee,LOW,1,480,0.01,0.04
nyt free spelling bee,LOW,0,480,,
spelling bee words for today,LOW,0,480,,
spelling for high schoolers,LOW,12,480,0.49,2.11
winning words in spelling bee,LOW,0,480,,
spelling help for 5th graders,MEDIUM,48,390,0.71,3.72
spelling bee free nyt,LOW,0,390,,
kindergarten spelling bee words,HIGH,76,390,0.54,1.38
spelling bee nyt unlimited,LOW,0,390,,
long spelling bee words,LOW,0,390,,
long word for spelling bee,LOW,0,390,,
nyt spelling bee help,LOW,0,390,,
spelling bee for today,LOW,0,390,,
spelling bee spelling list,LOW,12,390,0.01,0.07
spelling bee study list,LOW,0,390,,
spelling competition words list,LOW,12,390,0.01,0.07
spelling for students,LOW,0,390,,
wordle spelling bee unlimited,LOW,0,390,,
wordle today spelling bee,LOW,0,390,,
words for spelling bee today,LOW,0,390,,
spelling bee practice words,LOW,5,320,0.02,1.22
500 spelling bee words,MEDIUM,42,320,0.01,0.03
common spelling bee words,LOW,6,320,0.01,0.03
hard word to spell for 6th graders,LOW,28,320,,
medium spelling bee words,LOW,6,320,0.01,0.03
nyt spelling bee free online,LOW,0,320,,
popular spelling bee words,LOW,6,320,0.01,0.03
spelling bee for 12th graders,LOW,1,320,,
spelling bee winner words,LOW,0,320,,
spelling bee words nyt today,LOW,0,320,,
typical spelling bee words,LOW,6,320,0.01,0.03
wordle bee,LOW,0,320,,
free games like spelling bee,LOW,12,260,0.10,0.25
the spelling bee nyt,LOW,0,260,,
spelling bee for kindergarten,MEDIUM,45,260,0.34,2.09
bee wordle,LOW,0,260,,
dictionary for spelling bee,LOW,0,260,,
elementary spelling bee list,LOW,15,260,0.01,0.78
elementary spelling bee words,LOW,15,260,0.01,0.78
free bee spelling bee,LOW,0,260,,
free nyt spelling bee,LOW,0,260,,
help with spelling bee,LOW,0,260,,
new york times wordle spelling bee,LOW,1,260,0.06,0.13
ny times spelling bee words,LOW,0,260,,
spellbee free,LOW,0,260,,
spelling bee nyt words,LOW,0,260,,
spelling bee spanish words,LOW,0,260,,
spelling bee words today nyt,LOW,0,260,,
vocabulary words for spelling bee,LOW,1,260,,
words to spell for spelling bee,LOW,10,260,0.01,0.06
spelling bee book,MEDIUM,56,210,0.21,0.45
spelling bee games for adults,LOW,8,210,0.10,2.99
adult spelling bee word list,LOW,4,210,0.01,0.08
big spelling bee words,LOW,1,210,,
big word for spelling bee,LOW,1,210,,
fun spelling bee words,LOW,0,210,,
hardest spelling,LOW,0,210,,
k12 spelling,LOW,1,210,,
nyt spelling bee words today,LOW,0,210,,
nytimes com games spellingbee,LOW,4,210,0.06,0.24
nytimes spelling bee yesterday,LOW,0,210,,
shunn spelling bee latest,LOW,0,210,,
spell bee booklet,MEDIUM,56,210,0.21,0.45
spelling bee anagram,LOW,0,210,,
spelling bee for elementary,LOW,4,210,,
spelling bee practice list,LOW,5,210,,
spelling bee word list adults,LOW,4,210,0.01,0.08
spelling bee words new york times,LOW,0,210,,
words for the spelling bee today,LOW,0,210,,
ny times spelling bee free,LOW,0,170,0.07,0.42
easy spelling bee,LOW,3,170,0.50,1.58
funny spelling bee words for adults,LOW,0,170,,
hard words for 4th graders to spell,MEDIUM,63,170,,
knaidel,LOW,0,170,,
longest word spelling bee,LOW,0,170,,
merriam webster spelling bee,LOW,0,170,,
national adult spelling bee,LOW,0,170,,
new york times spelling bee free online,LOW,1,170,,
past spelling bee nyt,LOW,0,170,,
spell 8th,LOW,0,170,,
spell bee meaning,LOW,0,170,,
spelling bee like nyt,LOW,0,170,,
spelling bee nyt help,LOW,0,170,,
spelling bee study guide,LOW,3,170,,
spelling bee vocabulary,LOW,1,170,,
wordfinder spelling bee,LOW,0,170,,
words for spelling bee nyt,LOW,0,170,,
spelling bee preparation,LOW,8,140,0.61,4.60
spelling bee practice online,LOW,4,140,2.00,5.70
spelling bee practice games,LOW,2,140,,
nytimes spelling bee com,LOW,0,140,,
advanced spelling bee words,LOW,6,140,,
hard spelling words for 4th graders,MEDIUM,37,140,0.95,3.41
hard word to spell for 8th graders,LOW,1,140,,
new york times spelling bee for today,LOW,0,140,,
spellbee nytimes,LOW,0,140,,
spelling bee advanced words,LOW,6,140,,
spelling bee final words,LOW,0,140,,
spelling bee study,LOW,3,140,,
spelling bee words advanced,LOW,6,140,,
the nyt spelling bee,LOW,0,140,,
wordle spelling bee free,LOW,0,140,,
7 letter spelling bee,LOW,0,110,,
akeelah and the bee words,LOW,0,110,,
champion spelling bee words,LOW,0,110,,
good spelling bee words for adults,LOW,5,110,0.01,0.04
google spell bee,LOW,0,110,,
new york times spelling bee words,LOW,0,110,,
ny times spelling bee words today,LOW,0,110,,
practice british spelling,LOW,0,110,,
really hard spelling bee words,LOW,2,110,0.01,0.02
spell bee competition words,LOW,3,110,0.01,0.05
spell bee spell bee,LOW,0,110,,
spell bee worksheets,LOW,20,110,,
spelling bee definition,LOW,0,110,,
spelling bee long words,LOW,0,110,,
spelling bee ninja,LOW,0,110,,
spelling bee practice test,LOW,2,110,,
spelling words for spelling bee competition,LOW,3,110,0.01,0.05
thanksgiving spelling words,LOW,0,110,,
training for spelling bee,LOW,11,110,0.89,3.49
very hard spelling bee words,LOW,2,110,0.01,0.02
word for spelling bee competition,LOW,3,110,0.01,0.05
best way to study for a spelling bee,LOW,16,90,1.04,2.62
intermediate spelling bee words,LOW,2,90,,
medical spelling bee words,LOW,0,90,,
nyt the bee,LOW,0,90,,
random spelling bee words,LOW,1,90,,
scripps national spelling bee winning words,LOW,0,90,,
senior spelling bee words,LOW,0,90,,
spellbee words,LOW,6,90,0.01,0.03
spelling bee genius,LOW,0,90,,
spelling bee intermediate words,LOW,2,90,,
spelling bee medical words,LOW,0,90,,
spelling bee nyt yesterday,LOW,0,90,,
spelling bee today words,LOW,0,90,,
spelling bee tricky words,LOW,2,90,,
spelling bee words for,LOW,6,90,0.01,0.03
spelling bee words intermediate,LOW,2,90,,
spelling bee words wordle,LOW,0,90,,
tricky spelling bee words,LOW,2,90,,
tricky words for spelling bee,LOW,2,90,,
unlimited spelling bee nyt,LOW,0,90,,
word in spelling bee,LOW,4,90,0.01,2.94
words to spell in a spelling bee,LOW,6,90,0.01,0.03
the bee nyt,LOW,0,70,,
nyt word bee,LOW,1,70,,
11 11 spelling,LOW,2,70,,
all spelling bee words,LOW,1,70,,
all words for spelling bee today,LOW,0,70,,
bee spelling nyt,LOW,0,70,,
bible spelling bee,LOW,0,70,,
english spell bee words,LOW,0,70,,
english words for spelling competition,LOW,0,70,,
free bee nyt,LOW,0,70,,
free spelling bee apps,LOW,3,70,0.58,2.47
hard spelling words for 8th graders,LOW,8,70,,
hard words to spell for 4th graders,LOW,28,70,,
hard words to spell for 7th graders,LOW,0,70,,
national spelling bee winning words,LOW,0,70,,
national spelling bee word list,LOW,0,70,,
nyt free bee,LOW,0,70,,
senior spelling bee,LOW,0,70,,
seventh spelling,LOW,0,70,,
spell competition words,LOW,3,70,,
spelling bee english words,LOW,0,70,,
spelling bee example,LOW,1,70,,
spelling bee games for free,LOW,3,70,,
spelling bee letter,LOW,0,70,,
spelling bee nyt words today,LOW,0,70,,
spelling bee sample,LOW,1,70,,
spelling bee with friends,LOW,3,70,,
spelling bee words easy to hard,LOW,3,70,,
spelling bee words ny times,LOW,0,70,,
spelling challenge words,LOW,11,70,,
wordle spelling bee words,LOW,0,70,,
words in spelling bee today,LOW,0,70,,
world spelling bee,LOW,0,70,,
www nytimes spelling bee,LOW,0,70,,
word games like spelling bee,MEDIUM,35,50,0.10,0.54
www nytimes com spelling bee,LOW,1,50,,
the spelling bee new york times,LOW,0,50,,
6th spelling,LOW,1,50,,
a spelling test,LOW,8,50,0.50,1.79
akeelah and the bee spelling words,LOW,0,50,,
akeelah spelling bee words,LOW,0,50,,
basic spelling bee words,LOW,29,50,,
beginner spelling bee words,LOW,4,50,,
bible spelling bee word list,LOW,0,50,,
christmas spelling bee words,UNSPECIFIED,0,50,,
free new york times spelling bee,LOW,0,50,,
free ny times spelling bee,LOW,0,50,,
free spelling bee new york times,LOW,0,50,,
free spelling bee practice,LOW,0,50,,
hard words to spell for spelling bee,LOW,4,50,,
hardest spelling bee word ever,LOW,1,50,,
medium level spelling bee words,LOW,1,50,,
medium words for spelling bee,LOW,7,50,,
most common spelling bee words,LOW,0,50,,
most common words for spelling bee,LOW,0,50,,
most popular spelling bee words,LOW,0,50,,
ny times spell,LOW,0,50,,
nyt nyt spelling bee,LOW,0,50,,
nyt spelling bee word list,LOW,0,50,,
scripps national spelling bee practice,LOW,0,50,,
scripps spelling bee practice,LOW,0,50,,
simple spelling bee words,LOW,29,50,,
simple words for spelling bee,LOW,29,50,,
spelling bee christmas words,UNSPECIFIED,0,50,,
spelling bee medium words,LOW,5,50,,
spelling bee new york times unlimited,LOW,0,50,,
spelling bee nytimes com,LOW,0,50,,
spelling bee preparation material,LOW,8,50,,
spelling bee quiz for adults,LOW,2,50,,
spelling bee word list nyt,LOW,0,50,,
spelling bee words new york times today,LOW,0,50,,
super hard spelling bee words,LOW,5,50,0.01,0.02
the scripps national spelling bee,LOW,0,50,,
top spelling bee words,LOW,6,50,0.01,0.03
trap spelling bee word list,LOW,0,50,,
wordle unlimited spelling bee,LOW,0,50,,
words for a spelling bee for adults,LOW,7,50,0.01,0.07
words for nyt spelling bee,LOW,0,50,,
words to use in a spelling bee,LOW,3,50,,
words use in spelling bee,LOW,3,50,,
25th in words spelling,LOW,0,40,,
3rd spelling bee words,LOW,2,40,,
5th spelling bee words,LOW,5,40,,
adult spelling bee list,LOW,4,40,,
easy spelling bee words for adults,LOW,6,40,0.02,0.05
for spelling bee,LOW,0,40,,
genius spelling bee,LOW,0,40,,
kindergarten spelling bee word list,MEDIUM,43,40,,
ny times free spelling bee,LOW,0,40,,
nyt bee spelling,LOW,0,40,,
nyt spelling bee for free,LOW,0,40,,
nyt spelling wordle,LOW,0,40,,
quiz bee spelling words,LOW,0,40,,
sample spelling bee words,LOW,5,40,,
spell bee tricks,LOW,0,40,,
spelling bee activity,LOW,2,40,,
spelling bee example words,LOW,5,40,,
spelling bee for,LOW,0,40,,
spelling bee for 6 year olds,MEDIUM,56,40,,
spelling bee games for 5th graders,LOW,4,40,,
spelling bee word list kindergarten,MEDIUM,43,40,,
spelling bee words definitions and sentences,LOW,1,40,,
spelling bee words for adults hard,LOW,0,40,,
spelling bee words for adults with pronunciation,LOW,3,40,,
spelling bonus words,LOW,0,40,,
the great australian spelling bee,LOW,0,40,,
the word bee,LOW,0,40,,
vocabulary com spelling bee,LOW,0,40,,
www spelling bee nyt,LOW,0,40,,
spelling bee new york times free,LOW,0,30,,
6th spelling bee words,LOW,2,30,,
8th spelling bee words,LOW,0,30,,
crazy spelling bee words,LOW,3,30,,
easy words spelling bee,LOW,2,30,,
english spell bee,LOW,1,30,,
freshman spelling bee words,LOW,0,30,,
games like spelling bee free,LOW,26,30,,
hard spelling bee word list,LOW,1,30,,
hardest word to spell in spelling bee,LOW,1,30,,
hardest words to spell in spelling bee,LOW,1,30,,
impossible spelling bee words,LOW,0,30,,
medium hard spelling words,LOW,7,30,,
merriam webster spelling bee words,LOW,0,30,,
moderate spelling bee words,LOW,3,30,,
new york times free spelling bee,LOW,0,30,,
new york times spelling bee words today,LOW,0,30,,
nyt spelling bee dictionary,LOW,0,30,,
nyt spelling bee genius,LOW,0,30,,
random words for spelling bee,LOW,1,30,,
scripps national spelling bee study words for third graders,LOW,0,30,,
scripps spelling bee study guide,LOW,0,30,,
scripps word list,LOW,1,30,,
spell bee words meaning,LOW,0,30,,
spell bee words with pronunciation,LOW,2,30,,
spelling 8th,LOW,4,30,,
spelling bee big words,LOW,1,30,,
spelling bee easy to hard,LOW,1,30,,
spelling bee for 10th graders,LOW,2,30,,
spelling bee for 3rd graders games,MEDIUM,33,30,,
spelling bee games for 3rd graders,MEDIUM,33,30,,
spelling bee questions for adults,LOW,5,30,,
spelling bee test for adults,LOW,1,30,,
spelling bee test words,LOW,5,30,,
spelling bee words and definitions,LOW,1,30,,
spelling bee words and meaning,LOW,0,30,,
spelling bee words and pronunciation,LOW,2,30,,
spelling bee words and sentences,LOW,0,30,,
spelling bee words for 7th and 8th graders,LOW,9,30,,
spelling bee words with sentences,LOW,0,30,,
word bee nyt,LOW,0,30,,
word bee nytimes,LOW,0,30,,
wordbee nyt,LOW,0,30,,
words for spelling bee hard,LOW,3,30,,
words for spelling bee new york times,LOW,0,30,,
words spelling bee today,LOW,0,30,,
words to use for spelling bee,LOW,5,30,,
100 spelling bee words,LOW,0,20,,
4th spelling bee words,LOW,0,20,,
7th spelling bee words,LOW,3,20,,
acsi spelling bee word list,LOW,0,20,,
advanced spelling bee words for adults,LOW,0,20,,
anagram spelling bee,LOW,0,20,,
bee words list,LOW,3,20,,
crossword spelling bee,LOW,0,20,,
difficult spelling bee words for adults,LOW,0,20,,
easy to hard spelling bee words,LOW,0,20,,
family spelling bee words,LOW,0,20,,
free games like nyt spelling bee,MEDIUM,41,20,0.10,1.35
free games like nytimes spelling bee,MEDIUM,41,20,0.10,1.35
free online bee games,LOW,10,20,,
free spelling bee quiz,LOW,0,20,,
funny words for spelling bee,LOW,0,20,,
games similar to spelling bee nyt,LOW,31,20,0.10,3.38
halloween spelling bee words,LOW,0,20,,
hard spelling bee questions,LOW,1,20,,
hard spelling bee words for 6th graders,LOW,0,20,,
hard spelling bee words with pronunciation,LOW,1,20,,
junior spelling bee words,LOW,2,20,,
longest word in english spelling bee,LOW,0,20,,
new york times spelling bee unlimited,LOW,0,20,,
ny times spelling bee unlimited,LOW,2,20,,
nyt spelling bee missing words,LOW,0,20,,
online spelling bee quiz,LOW,0,20,,
regional spelling bee words,LOW,0,20,,
spelling bee 450 word list,LOW,0,20,,
spelling bee for preschoolers,LOW,9,20,,
spelling bee for teens,LOW,7,20,,
spelling bee games for 4th graders,LOW,29,20,,
spelling bee genius level,LOW,0,20,,
spelling bee list for kindergarten,LOW,1,20,,
spelling bee medical terms,LOW,0,20,,
spelling bee ny times free,LOW,0,20,,
spelling bee nyt free online,LOW,0,20,,
spelling bee online hard,LOW,2,20,,
spelling bee online test free,LOW,0,20,,
spelling bee preparation for beginners,LOW,0,20,,
spelling bee random words,LOW,0,20,,
spelling bee study words,LOW,4,20,,
spelling bee two letter list,LOW,0,20,,
spelling bee word bank,LOW,0,20,,
spelling bee words for elementary students,LOW,14,20,,
spelling bee words to practice,LOW,2,20,,
spelling bee words with definitions,LOW,0,20,,
spellingbee com word list,LOW,0,20,,
the ny times spelling bee,LOW,0,20,,
the spelling bee book,MEDIUM,48,20,,
top 10 hardest spelling bee words,LOW,0,20,,
trap spelling bee words,MEDIUM,51,20,,
two letter list spelling bee,LOW,0,20,,
words for spelling b,LOW,30,20,,
words to practice for spelling bee,LOW,14,20,,
words to spell for 8th graders,LOW,0,20,,
words to study for a spelling bee,LOW,9,20,,
www spellingbee com word list,LOW,0,20,,
spelling programs for elementary,HIGH,100,10,,
spelling help for middle schoolers,HIGH,100,10,2.87,12.02
scripps spelling bee 2023 word list,LOW,0,10,,
spelling bee words 2022,UNSPECIFIED,0,10,,
the spelling bee ny times,LOW,1,10,,
the times spelling bee,LOW,0,10,,
the new york times bee,LOW,0,10,,
